Category,English Phrase,Traditional Chinese,Usage Note,Difficulty
Post Office & Admin,Is this the right office for...?,這裡是辦理⋯的辦公室嗎？,confirming you are in the right place,intermediate
Post Office & Admin,How long will it take to process?,處理需要多長時間？,asking about processing time,intermediate
Weather,What's the weather like today?,今天天氣怎麼樣？,asking about today's weather,intermediate
Weather,What's the forecast for tomorrow?,明天的天氣預報怎麼說？,asking about tomorrow's weather,intermediate
Weather,It's going to rain later.,等一下會下雨。,predicting rain,intermediate
Weather,You should bring an umbrella.,你應該帶雨傘。,advising someone to take an umbrella,intermediate
Weather,It's really hot today.,今天真的很熱。,commenting on hot weather,intermediate
Weather,It's absolutely freezing!,真的冷死了！,commenting on very cold weather,intermediate
Weather,It's a bit chilly today.,今天有點涼。,commenting on cool weather,intermediate
Weather,"It's a lovely day, isn't it?",今天天氣真好，不是嗎？,commenting positively on good weather,intermediate
Weather,The weather's been terrible lately.,最近天氣一直很差。,commenting on bad recent weather,intermediate
Weather,It's cloudy but dry.,天空多雲但沒有下雨。,describing overcast but dry conditions,intermediate
Weather,There's a storm coming.,暴風雨要來了。,warning of an approaching storm,intermediate
Weather,It cleared up nicely.,天氣放晴了。,saying the weather improved,intermediate
Weather,The humidity is unbearable.,濕度讓人難以忍受。,complaining about high humidity,intermediate
Weather,I hope it doesn't rain.,希望不要下雨。,expressing a wish for dry weather,intermediate
Weather,It's perfect weather for...,這是⋯的完美天氣。,saying the weather suits a particular activity,intermediate
Weather,Dress warmly today.,今天要穿暖一點。,advising someone to dress for cold weather,intermediate
Weather,Wear sunscreen today.,今天要擦防曬乳。,advising someone to protect their skin,intermediate
Weather,I love this kind of weather.,我喜歡這種天氣。,expressing appreciation for current conditions,intermediate
Weather,What a beautiful sunrise!,多美的日出啊！,commenting on a beautiful sunrise,intermediate
Weather,The sky looks amazing tonight.,今晚的天空看起來真美。,commenting on a beautiful night sky,intermediate
Language Learning,Do you speak English?,你說英文嗎？,asking if someone speaks English,intermediate
Language Learning,Does anyone here speak English?,這裡有人說英文嗎？,asking a group if anyone speaks English,intermediate
Language Learning,I'm learning English.,我在學英文。,saying you are studying English,intermediate
Language Learning,My English isn't very good.,我的英文不是很好。,apologising for limited language ability,intermediate
Language Learning,I'm still learning.,我還在學習中。,explaining you are a learner,intermediate
Language Learning,Please speak slowly.,請說慢一點。,asking someone to reduce their speaking speed,intermediate
Language Learning,Could you repeat that?,你可以再說一次嗎？,asking for repetition,intermediate
Language Learning,How do you say... in English?,⋯用英文怎麼說？,asking for the English word for something,intermediate
Language Learning,Is my pronunciation correct?,我的發音正確嗎？,asking for feedback on pronunciation,intermediate
Language Learning,Can you correct me if I make a mistake?,如果我說錯了你可以糾正我嗎？,asking someone to point out errors,intermediate
Language Learning,I didn't understand that.,我沒聽懂那個。,saying you didn't comprehend something,intermediate
Language Learning,Is there a simpler way to say that?,有更簡單的說法嗎？,asking for a simpler expression,intermediate
Language Learning,I know a little English.,我會一點英文。,expressing basic language ability,intermediate
Language Learning,I used to study English at school.,我以前在學校學英文。,saying you studied English previously,intermediate
Language Learning,I need to practise more.,我需要多練習。,saying you need more practice,intermediate
Language Learning,I find grammar difficult.,我覺得文法很難。,expressing difficulty with grammar,intermediate
Language Learning,Can you write that down for me?,你可以幫我把那個寫下來嗎？,asking for something to be written,intermediate
