Category,English Phrase,Traditional Chinese,Usage Note
Greetings,Good morning!,早安！,said when meeting someone in the morning
Greetings,Good afternoon!,午安！,said when meeting someone in the afternoon
Greetings,Good evening!,晚安！,said when meeting someone in the evening
Greetings,Hi!,嗨！,casual informal greeting
Greetings,Hello!,你好！,standard greeting for any time of day
Greetings,Hey!,嘿！,very casual greeting between friends
Greetings,How are you?,你好嗎？,standard way to ask about someone's wellbeing
Greetings,How are you doing?,你最近怎麼樣？,casual way to ask how someone is
Greetings,How's it going?,最近還好嗎？,informal way to greet someone
Greetings,How have you been?,你最近過得怎麼樣？,used when you haven't seen someone for a while
Greetings,"I'm fine, thank you.",我很好，謝謝。,standard polite response to 'How are you'
Greetings,"I'm doing well, thanks.",我過得很好，謝謝。,casual positive response
Greetings,"Not bad, thanks.",還不錯，謝謝。,neutral positive response
Greetings,"Pretty good, thanks.",還挺好的，謝謝。,informal positive response
Greetings,"Could be better, to be honest.",說實話，可以更好。,honest response when things aren't great
Greetings,I've been busy lately.,我最近很忙。,common response explaining your situation
Greetings,Same as always.,一如既往。,response meaning nothing has changed
Greetings,Nice to meet you!,很高興認識你！,said when meeting someone for the first time
Greetings,Nice to meet you too!,我也很高興認識你！,response when someone says nice to meet you
Greetings,It's great to see you again!,很高興再次見到你！,said when reuniting with someone
Greetings,Long time no see!,好久不見！,said after a long time apart
Greetings,What a surprise!,真是個驚喜！,said when unexpectedly running into someone
Greetings,I haven't seen you in ages!,我好久沒看到你了！,said after a very long time apart
Greetings,Welcome!,歡迎！,greeting someone arriving at a place
Greetings,Welcome back!,歡迎回來！,greeting someone returning
Greetings,"Come in, please.",請進。,inviting someone to enter
Greetings,Please have a seat.,請坐。,inviting someone to sit down
Greetings,Make yourself at home.,請不要拘束。,telling a guest to feel comfortable
Greetings,Can I get you anything?,我能為你拿點什麼嗎？,offering hospitality to a guest
Greetings,What brings you here?,你怎麼來了？,asking why someone has come
Farewells,Goodbye!,再見！,standard farewell
Farewells,Bye!,拜拜！,casual farewell
Farewells,Bye bye!,拜拜！,very casual farewell often used with children
Farewells,See you later!,待會見！,saying goodbye when you'll see them again soon
Farewells,See you tomorrow!,明天見！,saying goodbye when you'll meet the next day
Farewells,See you next time!,下次見！,saying goodbye until the next meeting
Farewells,See you around!,有緣再見！,casual goodbye when you're not sure when you'll meet again
Farewells,Take care!,保重！,wishing someone well when parting
Farewells,Take care of yourself!,好好照顧自己！,showing care when saying goodbye
Farewells,Have a good day!,祝你有美好的一天！,wishing someone well for the day
Farewells,Have a great weekend!,週末愉快！,said on a Friday or before the weekend
Farewells,Have a safe trip!,一路平安！,wishing someone safe travels
Farewells,Enjoy your holiday!,假期愉快！,wishing someone a good holiday
Farewells,Good luck!,祝你好運！,wishing success before a challenge
Farewells,All the best!,一切順利！,a warm general farewell
Farewells,Keep in touch!,保持聯絡！,asking someone to stay in contact
Farewells,I'll talk to you later.,我們待會再聊。,saying you'll continue a conversation later
Farewells,I have to go now.,我現在要走了。,explaining you need to leave
Farewells,I'll be off then.,那我先走了。,polite way of saying you're leaving
Farewells,It was nice talking to you.,很高興和你聊天。,polite farewell after a conversation
Farewells,It was lovely to see you.,很高興見到你。,warm farewell after meeting someone
Farewells,Thanks for having me.,謝謝你的招待。,thanking a host when leaving
Farewells,Good night!,晚安！,farewell said in the evening or before sleep
Farewells,Sleep well!,好好休息！,wishing someone a good sleep
Farewells,Drive safe!,開車小心！,wishing someone safe driving
Farewells,Say hi to your family!,代我向你的家人問好！,asking someone to pass greetings to their family
Introductions,My name is...,我的名字是⋯,introducing your name formally
Introductions,I'm...,我是⋯,casual way to introduce your name
Introductions,You can call me...,你可以叫我⋯,telling someone your preferred name or nickname
Introductions,What's your name?,你叫什麼名字？,asking someone's name casually
Introductions,May I ask your name?,請問你叫什麼名字？,asking someone's name politely
Introductions,"This is my friend,...",這是我的朋友，⋯,introducing a friend to someone
Introductions,I'd like to introduce...,我想介紹⋯,formal way to introduce someone
Introductions,Have you two met?,你們兩個見過面嗎？,asking if two people know each other
Introductions,I don't think we've met.,我想我們還沒見過面。,saying you don't know someone yet
Introductions,Where are you from?,你來自哪裡？,asking about someone's hometown or country
Introductions,I'm from...,我來自⋯,saying where you are from
Introductions,I was born in...,我出生在⋯,saying where you were born
Introductions,I live in...,我住在⋯,saying where you currently live
Introductions,I'm originally from... but I live in...,我原本來自⋯但我住在⋯,explaining your origin and current location
Introductions,What do you do?,你從事什麼工作？,asking about someone's job or occupation
Introductions,I work as a...,我是一名⋯,saying what your job is
Introductions,I'm a student.,我是一名學生。,saying you are a student
Introductions,I'm currently looking for work.,我目前在找工作。,saying you are job hunting
Introductions,I'm retired.,我退休了。,saying you are retired
Introductions,How old are you?,你幾歲？,"asking someone's age, used carefully in some cultures"
Introductions,I'm... years old.,我⋯歲。,saying your age
Introductions,Are you married?,你結婚了嗎？,asking about marital status
Introductions,I'm single.,我單身。,saying you are not in a relationship
Introductions,I'm married.,我結婚了。,saying you are married
Introductions,Do you have any children?,你有孩子嗎？,asking if someone has children
Introductions,I have... kids.,我有⋯個孩子。,saying how many children you have
Introductions,What are your hobbies?,你有什麼興趣愛好？,asking about someone's hobbies
Introductions,I enjoy...,我喜歡⋯,talking about your interests
Introductions,In my free time I like to...,我空閒時喜歡⋯,describing what you do in your free time
Introductions,It's a pleasure to meet you.,很榮幸認識你。,formal way of saying nice to meet you
Introductions,Likewise.,我也是。,short response meaning the same to you
Small Talk,What's new?,有什麼新鮮事嗎？,casual way to ask what's happening in someone's life
Small Talk,Anything interesting happening?,有什麼有趣的事嗎？,casual conversation opener
Small Talk,How was your weekend?,你的週末過得怎麼樣？,common Monday conversation starter
Small Talk,Did you do anything fun?,你有做什麼有趣的事嗎？,asking if someone did something enjoyable
Small Talk,How's the family?,家人都好嗎？,asking about someone's family
Small Talk,How's work going?,工作怎麼樣？,asking about someone's work situation
Small Talk,Have you seen any good movies lately?,你最近有看什麼好電影嗎？,casual conversation starter about movies
Small Talk,Are you following the news?,你有在關注新聞嗎？,asking if someone keeps up with current events
Small Talk,What do you think about...?,你覺得⋯怎麼樣？,asking for someone's opinion
Small Talk,"It's a beautiful day, isn't it?",今天天氣很好，不是嗎？,weather-based small talk
Small Talk,The weather's been crazy lately.,最近天氣真的很奇怪。,commenting on unusual weather
Small Talk,Can you believe this weather?,你敢相信這天氣嗎？,expressing surprise about the weather
Small Talk,It's so hot today!,今天好熱！,commenting on hot weather
Small Talk,It's freezing today!,今天好冷！,commenting on cold weather
Small Talk,I love this time of year.,我喜歡這個時節。,expressing appreciation for the season
Small Talk,Are you from around here?,你是本地人嗎？,asking if someone is local
Small Talk,Have you lived here long?,你住在這裡很久了嗎？,asking about someone's time in a place
Small Talk,Do you know any good restaurants around here?,你知道這附近有什麼好的餐廳嗎？,asking for local recommendations
Small Talk,I've been really busy lately.,我最近真的很忙。,explaining your situation in conversation
Small Talk,"Time flies, doesn't it?",時間過得真快，不是嗎？,commenting on how fast time passes
Small Talk,I can't believe it's already...,我不敢相信已經⋯了。,expressing surprise at time passing
Small Talk,Any plans for the holidays?,假期有什麼計劃嗎？,asking about holiday plans
Small Talk,Looking forward to anything?,有在期待什麼嗎？,asking if someone is anticipating something
Small Talk,That sounds fun!,聽起來很有趣！,responding positively to someone's plans
Small Talk,That's interesting.,那很有趣。,showing interest in what someone said
Small Talk,Really? Tell me more.,真的嗎？多說一些。,encouraging someone to continue talking
Small Talk,I know what you mean.,我懂你的意思。,showing understanding
Small Talk,Same here.,我也是。,saying you share the same experience or feeling
Small Talk,You're telling me!,你說的沒錯！,strongly agreeing with what someone said
Small Talk,Tell me about it!,別說了！我懂！,"strongly agreeing, often with some frustration"
Asking for Help,Can you help me?,你能幫我嗎？,direct way to ask for help
Asking for Help,"Could you help me, please?",你可以幫我嗎？,polite way to ask for help
Asking for Help,I need some help.,我需要一些幫助。,stating you need assistance
Asking for Help,I need your help.,我需要你的幫助。,asking specifically for someone's help
Asking for Help,Would you mind helping me?,你介意幫我嗎？,very polite request for help
Asking for Help,Do you have a moment?,你有空嗎？,asking if someone is free to help
Asking for Help,Can I ask you something?,我可以問你一件事嗎？,asking permission to ask a question
Asking for Help,Sorry to bother you.,不好意思打擾你。,polite opener before asking for something
Asking for Help,"Excuse me, I'm a bit lost.",不好意思，我有點迷路了。,asking for help with directions
Asking for Help,I'm looking for...,我在找⋯,asking for help locating something
Asking for Help,Do you know where... is?,你知道⋯在哪裡嗎？,asking for the location of something
Asking for Help,Could you point me in the right direction?,你能指引我方向嗎？,asking for directional guidance
Asking for Help,I can't figure this out.,我搞不清楚這個。,expressing difficulty with something
Asking for Help,I'm not sure how to...,我不確定如何⋯,expressing uncertainty about a process
Asking for Help,Could you show me how to...?,你可以示範給我看如何⋯嗎？,asking for a demonstration
Asking for Help,Could you explain that again?,你可以再解釋一次嗎？,asking for clarification
Asking for Help,Is there anyone who can help me?,有人可以幫我嗎？,asking if assistance is available
Asking for Help,Where can I get help with...?,我可以在哪裡得到關於⋯的幫助？,asking where to find help
Asking for Help,I'd appreciate your help.,我很感激你的幫助。,expressing gratitude in advance
Asking for Help,That would be a great help.,那會幫上很大的忙。,responding when someone offers to help
Asking for Help,You're a lifesaver!,你真是救星！,expressing great relief at someone's help
Asking for Help,I owe you one.,我欠你一個人情。,saying you're grateful and will return the favour
Asking for Help,Thank you so much for your help.,非常感謝你的幫助。,thanking someone after they helped
Asking for Help,I really appreciate it.,我真的很感激。,expressing deep gratitude
Asking for Help,I couldn't have done it without you.,沒有你我做不到。,expressing how important someone's help was
Requests & Offers,Could you please...?,你可以⋯嗎？,polite way to make a request
Requests & Offers,Would you mind...?,你介意⋯嗎？,very polite way to ask someone to do something
Requests & Offers,Can you...?,你能⋯嗎？,direct way to make a request
Requests & Offers,Please...,請⋯,simple polite request
Requests & Offers,I was wondering if you could...,我想知道你是否能⋯,indirect and polite request
Requests & Offers,Do you think you could...?,你覺得你能⋯嗎？,gentle way of making a request
Requests & Offers,Is it possible to...?,有可能⋯嗎？,asking if something can be done
Requests & Offers,Would it be okay if...?,如果⋯可以嗎？,asking permission politely
Requests & Offers,Could I ask you to...?,我可以請你⋯嗎？,politely asking someone to do something
Requests & Offers,If you don't mind...,如果你不介意的話⋯,softening a request
Requests & Offers,Would you like some help?,你需要幫忙嗎？,offering assistance
Requests & Offers,Can I help you with that?,我可以幫你那個嗎？,offering help with a specific task
Requests & Offers,Let me help you.,讓我幫你。,offering help directly
Requests & Offers,Shall I...?,要我⋯嗎？,offering to do something
Requests & Offers,Do you need anything?,你需要什麼嗎？,general offer of assistance
Requests & Offers,Would you like me to...?,你要我⋯嗎？,offering to do something specific
Requests & Offers,I'd be happy to help.,我很樂意幫忙。,willingly accepting a request to help
Requests & Offers,Leave it to me.,交給我吧。,confidently taking responsibility for something
Requests & Offers,No problem at all.,完全沒問題。,accepting a request easily
Requests & Offers,"Sure, I can do that.",當然，我可以做到。,agreeing to a request
Requests & Offers,I'll get right on it.,我馬上去做。,saying you'll start something immediately
Requests & Offers,Could you do me a favour?,你可以幫我一個忙嗎？,asking for a favour
Requests & Offers,That's very kind of you.,你真的很好心。,thanking someone for their offer
Requests & Offers,I really appreciate the offer.,我真的很感謝你的提議。,thanking someone for offering to help
Requests & Offers,"I'm fine, but thank you.",我沒事，但謝謝你。,politely declining an offer
Requests & Offers,"Thanks, but I can manage.",謝謝，但我可以自己來。,politely declining help
Polite Expressions,Thank you.,謝謝你。,basic expression of gratitude
Polite Expressions,Thank you very much.,非常感謝你。,stronger expression of gratitude
Polite Expressions,Thanks a lot.,非常感謝。,informal strong thanks
Polite Expressions,Many thanks.,多謝。,formal expression of thanks
Polite Expressions,I'm grateful for your help.,我很感激你的幫助。,formal expression of gratitude
Polite Expressions,You're too kind.,你真是太好了。,responding to someone's generosity
Polite Expressions,You're welcome.,不客氣。,standard response to thank you
Polite Expressions,No worries.,沒關係。,casual response to thank you
Polite Expressions,Don't mention it.,別客氣。,modest response to thank you
Polite Expressions,My pleasure.,這是我的榮幸。,saying you were happy to help
Polite Expressions,Anytime.,隨時。,saying you're always willing to help
Polite Expressions,It was nothing.,這沒什麼。,modest response saying the help was easy
Polite Expressions,I'm sorry.,對不起。,standard apology
Polite Expressions,I'm really sorry.,我真的很抱歉。,stronger apology
Polite Expressions,I'm so sorry about that.,我真的很抱歉那件事。,apologising for a specific thing
Polite Expressions,Please accept my apologies.,請接受我的道歉。,formal apology
Polite Expressions,I apologize for the inconvenience.,對於造成的不便我深感抱歉。,formal apology for causing trouble
Polite Expressions,I didn't mean to.,我不是故意的。,explaining something was unintentional
Polite Expressions,It won't happen again.,這不會再發生了。,promising not to repeat a mistake
Polite Expressions,Excuse me.,不好意思。,getting someone's attention or apologising for a small thing
Polite Expressions,Pardon me.,抱歉打擾。,polite way to get attention or ask someone to repeat
Polite Expressions,After you.,您先請。,politely letting someone go first
Polite Expressions,Please go ahead.,請先走。,telling someone to proceed
Polite Expressions,Could you please speak more slowly?,你可以說慢一點嗎？,asking someone to slow down their speech
Polite Expressions,Would you mind repeating that?,你介意再說一次嗎？,politely asking someone to repeat something
Polite Expressions,I beg your pardon?,請問你說什麼？,politely asking someone to repeat
Polite Expressions,That's very thoughtful of you.,你真的很體貼。,thanking someone for their thoughtfulness
Agreeing & Disagreeing,I agree.,我同意。,simply agreeing with someone
Agreeing & Disagreeing,I totally agree.,我完全同意。,strongly agreeing
Agreeing & Disagreeing,Absolutely.,絕對是。,strongly agreeing
Agreeing & Disagreeing,Exactly!,正是！,agreeing precisely with what was said
Agreeing & Disagreeing,That's right.,沒錯。,confirming agreement
Agreeing & Disagreeing,You're right.,你說得對。,acknowledging someone is correct
Agreeing & Disagreeing,I think so too.,我也這麼認為。,expressing shared opinion
Agreeing & Disagreeing,I couldn't agree more.,我非常同意。,expressing maximum agreement
Agreeing & Disagreeing,That's a good point.,這是個好觀點。,acknowledging someone made a valid point
Agreeing & Disagreeing,I see what you mean.,我明白你的意思。,showing understanding of someone's point
Agreeing & Disagreeing,Fair enough.,有道理。,accepting someone's point as reasonable
Agreeing & Disagreeing,I'm with you on that.,在這點上我支持你。,agreeing with someone's position
Agreeing & Disagreeing,I disagree.,我不同意。,directly disagreeing
Agreeing & Disagreeing,I don't think so.,我不這麼認為。,politely disagreeing
Agreeing & Disagreeing,I'm not sure I agree.,我不確定我是否同意。,gently disagreeing
Agreeing & Disagreeing,I see it differently.,我的看法不同。,politely expressing a different view
Agreeing & Disagreeing,That's not how I see it.,我的看法不是這樣。,expressing disagreement with a view
Agreeing & Disagreeing,I'm afraid I disagree.,恐怕我不同意。,polite formal disagreement
Agreeing & Disagreeing,"I understand your point, but...",我理解你的觀點，但是⋯,acknowledging before disagreeing
Agreeing & Disagreeing,"That may be true, but...",那可能是真的，但是⋯,partially agreeing before disagreeing
Agreeing & Disagreeing,With all due respect...,恕我冒昧⋯,introducing a polite disagreement
Agreeing & Disagreeing,"I take your point, however...",我理解你的意思，但是⋯,acknowledging then disagreeing
Agreeing & Disagreeing,That depends.,這要看情況。,saying the answer isn't straightforward
Agreeing & Disagreeing,It's not that simple.,這沒那麼簡單。,saying the issue is more complex
Agreeing & Disagreeing,I'm on the fence about this.,我對這件事持中立態度。,saying you haven't decided yet
Agreeing & Disagreeing,I have mixed feelings about it.,我對此有複雜的感受。,expressing ambivalence
Agreeing & Disagreeing,"You make a good argument, but...",你的論點很好，但是⋯,acknowledging a strong point before disagreeing
Agreeing & Disagreeing,We'll have to agree to disagree.,我們只能各持己見了。,accepting that you won't reach agreement
Agreeing & Disagreeing,I see both sides.,我能理解兩方的立場。,showing you understand multiple perspectives
Agreeing & Disagreeing,That's one way to look at it.,那是一種看法。,acknowledging a view without fully agreeing
Opinions & Suggestions,"In my opinion,...",依我看⋯,introducing a personal opinion
Opinions & Suggestions,I think...,我認為⋯,sharing what you believe
Opinions & Suggestions,I believe...,我相信⋯,expressing a belief
Opinions & Suggestions,I feel that...,我覺得⋯,sharing a feeling-based opinion
Opinions & Suggestions,"As far as I'm concerned,...",就我而言⋯,giving your personal view
Opinions & Suggestions,"From my point of view,...",從我的角度來看⋯,sharing your perspective
Opinions & Suggestions,It seems to me that...,在我看來⋯,sharing what appears to be true to you
Opinions & Suggestions,"Personally, I think...",我個人認為⋯,emphasising a personal opinion
Opinions & Suggestions,"To be honest,...",說實話⋯,introducing a candid opinion
Opinions & Suggestions,"If you ask me,...",如果你問我⋯,sharing your opinion when asked
Opinions & Suggestions,What do you think?,你認為呢？,asking for someone's opinion
Opinions & Suggestions,What's your view on this?,你對這件事有什麼看法？,asking for someone's perspective
Opinions & Suggestions,How do you feel about that?,你對那個感覺怎麼樣？,asking about someone's feelings on something
Opinions & Suggestions,Do you have any thoughts on this?,你對這件事有什麼想法嗎？,asking for input
Opinions & Suggestions,What would you suggest?,你有什麼建議？,asking for a suggestion
Opinions & Suggestions,Why don't you...?,你何不⋯？,making a suggestion
Opinions & Suggestions,How about...?,⋯怎麼樣？,suggesting an option
Opinions & Suggestions,What about...?,⋯呢？,proposing an alternative
Opinions & Suggestions,Have you considered...?,你有考慮過⋯嗎？,suggesting something to think about
Opinions & Suggestions,You might want to try...,你可能可以試試⋯,making a gentle suggestion
Opinions & Suggestions,I would suggest...,我建議⋯,making a formal suggestion
Opinions & Suggestions,"If I were you, I would...",如果我是你，我會⋯,giving advice
Opinions & Suggestions,My suggestion would be...,我的建議是⋯,formally stating a suggestion
Opinions & Suggestions,It might be a good idea to...,⋯可能是個好主意。,suggesting something gently
Opinions & Suggestions,Have you thought about...?,你有想過⋯嗎？,suggesting someone consider something
Opinions & Suggestions,That's a great idea!,那是個很棒的主意！,enthusiastically agreeing with a suggestion
Opinions & Suggestions,That might work.,那可能行得通。,cautiously agreeing with a suggestion
Opinions & Suggestions,I'm not so sure about that.,我對那不太確定。,expressing doubt about a suggestion
Opinions & Suggestions,That's worth thinking about.,那值得考慮。,saying a suggestion has merit
Opinions & Suggestions,Let me think about it.,讓我想一想。,asking for time to consider
Asking for Clarification,"Sorry, I didn't catch that.",抱歉，我沒聽清楚。,saying you didn't hear or understand
Asking for Clarification,"Could you repeat that, please?",你可以再說一次嗎？,asking someone to say something again
Asking for Clarification,Could you say that again?,你可以再說一遍嗎？,asking for repetition
Asking for Clarification,"Sorry, what did you say?",抱歉，你說什麼？,asking someone to repeat informally
Asking for Clarification,"I'm sorry, I don't understand.",抱歉，我不明白。,saying you don't understand
Asking for Clarification,I'm not sure I follow.,我不確定我是否理解。,saying you're confused
Asking for Clarification,Could you explain that?,你可以解釋一下嗎？,asking for an explanation
Asking for Clarification,What do you mean by...?,你說的⋯是什麼意思？,asking for clarification on a specific point
Asking for Clarification,Could you be more specific?,你可以更具體一點嗎？,asking for more detail
Asking for Clarification,Can you give me an example?,你能給我舉個例子嗎？,asking for an example to understand better
Asking for Clarification,What exactly do you mean?,你到底是什麼意思？,asking for precise clarification
Asking for Clarification,I'm not sure what you mean.,我不確定你的意思是什麼。,expressing confusion about meaning
Asking for Clarification,Could you put that another way?,你可以換個方式說嗎？,asking for a different explanation
Asking for Clarification,In other words...?,換句話說⋯？,checking your understanding by rephrasing
Asking for Clarification,Do you mean...?,你的意思是⋯嗎？,checking your interpretation
Asking for Clarification,So what you're saying is...?,所以你的意思是⋯？,restating to confirm understanding
Asking for Clarification,Let me make sure I understand.,讓我確認一下我的理解。,checking your comprehension
Asking for Clarification,Just to clarify...,只是為了澄清⋯,making something clear
Asking for Clarification,Am I right in thinking that...?,我理解⋯是正確的嗎？,checking your understanding
Asking for Clarification,Is that what you mean?,那是你的意思嗎？,confirming interpretation
