Category,English Phrase,Traditional Chinese,Usage Note
Asking for Clarification,Could you speak more slowly?,你能說慢一點嗎？,asking someone to slow their speech
Asking for Clarification,Could you write that down?,你能把那個寫下來嗎？,asking for written clarification
Asking for Clarification,What does... mean?,⋯是什麼意思？,asking for the meaning of a word or phrase
Asking for Clarification,How do you spell that?,那個怎麼拼？,asking for the spelling
Asking for Clarification,How do you pronounce that?,那個怎麼發音？,asking for the pronunciation
Expressing Feelings,I'm happy.,我很開心。,saying you feel happy
Expressing Feelings,I'm really excited about this.,我對這件事真的很興奮。,expressing excitement
Expressing Feelings,I'm looking forward to it.,我很期待。,expressing anticipation
Expressing Feelings,I can't wait!,我等不及了！,expressing strong excitement
Expressing Feelings,I'm so relieved.,我好鬆了一口氣。,expressing relief
Expressing Feelings,I'm feeling a bit down.,我感覺有點低落。,saying you feel a little sad
Expressing Feelings,I'm really upset about this.,我對這件事真的很難過。,expressing sadness or upset
Expressing Feelings,I'm so frustrated!,我好挫折！,expressing frustration
Expressing Feelings,I'm feeling overwhelmed.,我感到不知所措。,saying you have too much to deal with
Expressing Feelings,I'm a bit stressed out.,我有點壓力很大。,saying you're under stress
Expressing Feelings,I'm exhausted.,我筋疲力盡了。,saying you're very tired
Expressing Feelings,I'm worried about...,我擔心⋯,expressing concern
Expressing Feelings,I'm nervous about...,我對⋯感到緊張。,expressing nervousness
Expressing Feelings,I'm scared of...,我害怕⋯,expressing fear
Expressing Feelings,I'm angry about...,我對⋯感到生氣。,expressing anger
Expressing Feelings,I'm disappointed.,我很失望。,expressing disappointment
Expressing Feelings,I feel lonely.,我感到孤獨。,saying you feel alone
Expressing Feelings,I feel much better now.,我現在感覺好多了。,saying your mood or health has improved
Expressing Feelings,I'm in a great mood today.,我今天心情很好。,saying you're in a positive mood
Expressing Feelings,I'm not in the mood for...,我沒有心情⋯,saying you don't feel like doing something
Expressing Feelings,That made my day!,那讓我今天很開心！,saying something made you very happy
Expressing Feelings,I'm really proud of you.,我真的為你感到驕傲。,expressing pride in someone
Expressing Feelings,That means a lot to me.,那對我意義很重大。,saying something is very meaningful
Expressing Feelings,I'm over the moon!,我開心極了！,expressing extreme happiness
Expressing Feelings,I feel terrible about this.,我對這件事感到非常糟糕。,expressing guilt or deep regret
Expressing Feelings,I'm heartbroken.,我心碎了。,expressing deep sadness
Expressing Feelings,I can't stop thinking about it.,我停不下來想它。,saying something is constantly on your mind
Expressing Feelings,I'm at a loss.,我不知所措。,saying you don't know what to do
Expressing Feelings,I feel so much better after talking about it.,說出來之後我感覺好多了。,expressing relief after sharing feelings
Expressing Feelings,That's such a relief!,真是太令人鬆了一口氣了！,expressing relief about good news
Compliments & Encouragement,You did a great job!,你做得很好！,praising someone's work or effort
Compliments & Encouragement,Well done!,做得好！,congratulating someone on a success
Compliments & Encouragement,That's impressive!,那很令人印象深刻！,expressing admiration
Compliments & Encouragement,You're very talented!,你非常有才華！,complimenting someone's ability
Compliments & Encouragement,I love your style!,我喜歡你的風格！,complimenting someone's personal style
Compliments & Encouragement,That looks amazing on you!,那穿在你身上看起來很棒！,complimenting how something looks on someone
Compliments & Encouragement,You look great today!,你今天看起來很棒！,complimenting someone's appearance
Compliments & Encouragement,Your English is excellent!,你的英文非常好！,complimenting language ability
Compliments & Encouragement,That was a brilliant idea!,那是個很棒的主意！,praising someone's idea
Compliments & Encouragement,You handled that really well.,你處理得非常好。,praising how someone dealt with a situation
Compliments & Encouragement,I'm really impressed by you.,我真的對你印象深刻。,expressing admiration for someone
Compliments & Encouragement,You should be proud of yourself.,你應該為自己感到驕傲。,encouraging someone to feel good about their achievement
Compliments & Encouragement,You're so thoughtful.,你真的很體貼。,complimenting someone's consideration
Compliments & Encouragement,That was very kind of you.,你這樣做真的很善良。,thanking someone for their kindness
Compliments & Encouragement,You're doing really well.,你做得真的很好。,encouragement during a process
Compliments & Encouragement,Keep it up!,繼續保持！,encouraging someone to maintain their effort
Compliments & Encouragement,Don't give up!,不要放棄！,encouraging perseverance
Compliments & Encouragement,You can do it!,你可以的！,encouraging someone to try
Compliments & Encouragement,Believe in yourself!,相信自己！,encouraging confidence
Compliments & Encouragement,I believe in you.,我相信你。,expressing confidence in someone
Compliments & Encouragement,You're almost there!,你快到了！,encouragement near the end of a task
Compliments & Encouragement,That's a great start!,這是個很好的開始！,praising an initial effort
Compliments & Encouragement,You're making real progress.,你真的在進步了。,acknowledging improvement
Compliments & Encouragement,Every little bit helps.,每一點都有幫助。,encouraging when progress is slow
Compliments & Encouragement,The effort you're putting in is amazing.,你付出的努力真的很了不起。,praising someone's hard work
Compliments & Encouragement,You've come so far!,你已經走了這麼長的路！,acknowledging how much someone has achieved
Making Plans,Are you free this weekend?,你這個週末有空嗎？,asking if someone is available
Making Plans,What are you up to this weekend?,你這個週末有什麼計劃？,asking about weekend plans
Making Plans,Would you like to...?,你想要⋯嗎？,suggesting a plan
Making Plans,Do you want to...?,你想⋯嗎？,casually suggesting an activity
Making Plans,How about we...?,我們⋯怎麼樣？,proposing an activity together
Making Plans,Why don't we...?,我們何不⋯？,suggesting an activity
Making Plans,Let's...,我們⋯吧。,suggesting an activity together
Making Plans,Shall we...?,我們⋯好嗎？,politely suggesting an activity
Making Plans,What do you feel like doing?,你想做什麼？,asking what someone wants to do
Making Plans,I'd love to!,我很想！,enthusiastically accepting a suggestion
Making Plans,That sounds like a great idea!,聽起來是個好主意！,accepting a plan enthusiastically
Making Plans,Count me in!,算我一份！,agreeing to join a plan
Making Plans,I'm in!,我加入！,enthusiastically agreeing to a plan
Making Plans,"Sorry, I can't make it.",抱歉，我沒辦法去。,declining a plan
Making Plans,I have other plans.,我有其他計劃。,explaining why you can't join
Making Plans,I'm not available then.,我那時候沒空。,saying you're busy at that time
Making Plans,Can we reschedule?,我們可以改時間嗎？,asking to change a plan
Making Plans,How does... sound?,⋯怎麼樣？,asking if a specific plan works for someone
Making Plans,Does that work for you?,那對你方便嗎？,checking if a plan suits someone
Making Plans,What time works for you?,什麼時間對你方便？,asking about someone's availability
Making Plans,Let's say... o'clock?,我們說⋯點好嗎？,proposing a specific time
Making Plans,Where shall we meet?,我們在哪裡見面？,deciding on a meeting location
Making Plans,Let's meet at...,我們在⋯見面吧。,suggesting a meeting place
Making Plans,I'll see you there!,我在那裡等你！,confirming you'll meet at an agreed place
Making Plans,Don't forget!,別忘了！,reminding someone about a plan
Making Plans,Can't wait to see you!,迫不及待想見到你！,expressing excitement about meeting someone
Apologies & Forgiveness,I'm so sorry.,我非常抱歉。,stronger apology
Apologies & Forgiveness,I'm really sorry about that.,我真的很抱歉那件事。,apologising for a specific thing
Apologies & Forgiveness,I apologize.,我道歉。,formal apology
Apologies & Forgiveness,Please forgive me.,請原諒我。,asking for forgiveness
Apologies & Forgiveness,That was my fault.,那是我的錯。,taking responsibility
Apologies & Forgiveness,I take full responsibility.,我完全負責。,accepting blame formally
Apologies & Forgiveness,I should have been more careful.,我應該更小心的。,admitting a mistake
Apologies & Forgiveness,I didn't mean to hurt you.,我不是故意傷害你的。,explaining an unintentional action
Apologies & Forgiveness,I had no idea it would cause a problem.,我不知道這會造成問題。,saying you were unaware
Apologies & Forgiveness,I'll make it up to you.,我會補償你的。,promising to make amends
Apologies & Forgiveness,How can I make it right?,我能怎麼做來彌補？,asking how to make amends
Apologies & Forgiveness,That's okay.,沒關係。,accepting an apology
Apologies & Forgiveness,"It's fine, don't worry about it.",沒事，不用擔心。,reassuring someone their apology is accepted
Apologies & Forgiveness,No harm done.,沒有造成傷害。,saying no damage was done
Apologies & Forgiveness,I understand.,我理解。,showing understanding after an apology
Apologies & Forgiveness,Let's forget about it.,讓我們忘掉這件事吧。,suggesting to move on
Apologies & Forgiveness,I forgive you.,我原諒你。,formally granting forgiveness
Apologies & Forgiveness,Apology accepted.,接受你的道歉。,formally accepting an apology
Apologies & Forgiveness,We all make mistakes.,我們都會犯錯。,being understanding about someone's error
Apologies & Forgiveness,Don't worry about it.,不用擔心這件事。,reassuring someone
Apologies & Forgiveness,It happens to everyone.,這種事每個人都會遇到。,normalising a mistake
Apologies & Forgiveness,Let's move on.,讓我們繼續吧。,suggesting to put something behind you
Congratulations & Celebrations,Congratulations!,恭喜！,standard congratulation
Congratulations & Celebrations,I'm so proud of you!,我真的為你感到驕傲！,expressing pride in someone's achievement
Congratulations & Celebrations,You did it!,你做到了！,celebrating someone's success
Congratulations & Celebrations,That's wonderful news!,那真是太棒的消息了！,responding to good news
Congratulations & Celebrations,I'm so happy for you!,我真的為你感到開心！,expressing happiness for someone
Congratulations & Celebrations,You deserve it!,你應得的！,saying someone earned their success
Congratulations & Celebrations,What great news!,多好的消息啊！,reacting positively to good news
Congratulations & Celebrations,Happy birthday!,生日快樂！,birthday greeting
Congratulations & Celebrations,Many happy returns!,祝你生日快樂！,formal birthday greeting
Congratulations & Celebrations,Happy anniversary!,週年紀念日快樂！,anniversary greeting
Congratulations & Celebrations,Happy New Year!,新年快樂！,new year greeting
Congratulations & Celebrations,Merry Christmas!,聖誕節快樂！,Christmas greeting
Congratulations & Celebrations,Happy holidays!,節日快樂！,general holiday greeting
Congratulations & Celebrations,Let's celebrate!,我們來慶祝吧！,suggesting a celebration
Congratulations & Celebrations,This calls for a celebration!,這值得慶祝！,saying something deserves to be celebrated
Congratulations & Celebrations,Cheers!,乾杯！,a toast when drinking
Congratulations & Celebrations,Here's to you!,敬你！,a personal toast
Congratulations & Celebrations,Here's to our success!,為我們的成功乾杯！,a toast to shared success
Congratulations & Celebrations,Best wishes!,最美好的祝福！,general good wishes
Congratulations & Celebrations,Wishing you all the best!,祝你一切順利！,sending good wishes
Congratulations & Celebrations,Good luck with everything!,祝你一切順利！,wishing someone luck
Congratulations & Celebrations,I hope it goes well.,我希望一切順利。,wishing something goes successfully
Congratulations & Celebrations,You're going to do great!,你一定會表現很好！,encouraging someone before a challenge
Congratulations & Celebrations,Here's to a bright future!,為美好的未來乾杯！,toast to the future
